{
  "schemaVersion": 1,
  "generatedFrom": [
    "js/publishing-data.js"
  ],
  "generatedAt": "2026-03-14T22:40:35.285Z",
  "sagas": [
    {
      "id": "the-god-story-saga",
      "title": "The God Story Saga",
      "shortTitle": "The God Story Saga",
      "description": "A wider story world carrying the spiritual, symbolic, and long-form side of Triad of Angels through ToA Studios publishing.",
      "canonicalPath": "/publishing/sagas/the-god-story-saga/",
      "art": {
        "wide": "/assets/images/books/the-god-story-saga/hero-wide.webp"
      },
      "stores": {
        "amazonRegional": {
          "AU": "https://www.amazon.com.au/dp/B0GPWWN7LD",
          "US": "https://www.amazon.com/dp/B0GPWWN7LD",
          "UK": "https://www.amazon.co.uk/dp/B0GPWWN7LD",
          "CA": "https://www.amazon.ca/dp/B0GPWWN7LD",
          "DE": "https://www.amazon.de/dp/B0GPWWN7LD",
          "FR": "https://www.amazon.fr/dp/B0GPWWN7LD",
          "ES": "https://www.amazon.es/dp/B0GPWWN7LD",
          "IT": "https://www.amazon.it/dp/B0GPWWN7LD",
          "JP": "https://www.amazon.co.jp/dp/B0GPWWN7LD",
          "IN": "https://www.amazon.in/dp/B0GPWWN7LD",
          "NL": "https://www.amazon.nl/dp/B0GPWWN7LD",
          "SE": "https://www.amazon.se/dp/B0GPWWN7LD"
        }
      }
    }
  ],
  "series": [
    {
      "id": "unseen-age",
      "sagaId": "the-god-story-saga",
      "title": "The Unseen Age",
      "shortTitle": "Unseen Age",
      "description": "A series set within The God Story Saga, following the fracture between innocence, rebellion, consequence, and what rises from the unseen world around them.",
      "canonicalPath": "/publishing/series/unseen-age/"
    }
  ],
  "books": [
    {
      "id": "unseen-age-v1-before-breath",
      "title": "Before Breath",
      "subtitle": "The Unseen Age — Volume I",
      "author": "Triad of Angels",
      "year": "",
      "status": "Live",
      "sagaId": "the-god-story-saga",
      "seriesId": "unseen-age",
      "seriesNumber": 1,
      "genres": [],
      "formats": [
        "Kindle eBook"
      ],
      "logline": "The opening volume of The Unseen Age, laying the foundations of the world before the fracture fully reveals itself.",
      "description": "Before Breath begins the series at its source, establishing the spiritual and symbolic ground the later volumes will deepen. It is the clearest starting point for the reading order.",
      "canonicalPath": "/publishing/books/unseen-age-v1-before-breath/",
      "covers": {
        "portrait": "/assets/images/books/unseen-age-v1-before-breath/cover-portrait.webp",
        "square": "/assets/images/books/unseen-age-v1-before-breath/cover-portrait.webp",
        "wide": "/assets/images/books/unseen-age-v1-before-breath/cover-portrait.webp"
      },
      "stores": {
        "amazonRegional": {
          "AU": "https://www.amazon.com.au/dp/B0GPWC4527",
          "US": "https://www.amazon.com/dp/B0GPWC4527",
          "UK": "https://www.amazon.co.uk/dp/B0GPWC4527",
          "CA": "https://www.amazon.ca/dp/B0GPWC4527",
          "DE": "https://www.amazon.de/dp/B0GPWC4527",
          "FR": "https://www.amazon.fr/dp/B0GPWC4527",
          "ES": "https://www.amazon.es/dp/B0GPWC4527",
          "IT": "https://www.amazon.it/dp/B0GPWC4527",
          "JP": "https://www.amazon.co.jp/dp/B0GPWC4527",
          "IN": "https://www.amazon.in/dp/B0GPWC4527",
          "NL": "https://www.amazon.nl/dp/B0GPWC4527",
          "SE": "https://www.amazon.se/dp/B0GPWC4527"
        }
      }
    },
    {
      "id": "unseen-age-v2-the-garden-and-the-fracture",
      "title": "The Garden and the Fracture",
      "subtitle": "The Unseen Age — Volume II",
      "author": "Triad of Angels",
      "year": "",
      "status": "Live",
      "sagaId": "the-god-story-saga",
      "seriesId": "unseen-age",
      "seriesNumber": 2,
      "genres": [],
      "formats": [
        "Kindle eBook"
      ],
      "logline": "The second volume widens the rupture, carrying the reader deeper into consequence, division, and the changing shape of the world.",
      "description": "The Garden and the Fracture continues the series by moving further into the break itself — what is lost, what is altered, and what can no longer remain untouched.",
      "canonicalPath": "/publishing/books/unseen-age-v2-the-garden-and-the-fracture/",
      "covers": {
        "portrait": "/assets/images/books/unseen-age-v2-the-garden-and-the-fracture/cover-portrait.webp",
        "square": "/assets/images/books/unseen-age-v2-the-garden-and-the-fracture/cover-portrait.webp",
        "wide": "/assets/images/books/unseen-age-v2-the-garden-and-the-fracture/cover-portrait.webp"
      },
      "stores": {
        "amazonRegional": {
          "AU": "https://www.amazon.com.au/dp/B0GQP9FP81",
          "US": "https://www.amazon.com/dp/B0GQP9FP81",
          "UK": "https://www.amazon.co.uk/dp/B0GQP9FP81",
          "CA": "https://www.amazon.ca/dp/B0GQP9FP81",
          "DE": "https://www.amazon.de/dp/B0GQP9FP81",
          "FR": "https://www.amazon.fr/dp/B0GQP9FP81",
          "ES": "https://www.amazon.es/dp/B0GQP9FP81",
          "IT": "https://www.amazon.it/dp/B0GQP9FP81",
          "JP": "https://www.amazon.co.jp/dp/B0GQP9FP81",
          "IN": "https://www.amazon.in/dp/B0GQP9FP81",
          "NL": "https://www.amazon.nl/dp/B0GQP9FP81",
          "SE": "https://www.amazon.se/dp/B0GQP9FP81"
        }
      }
    },
    {
      "id": "unseen-age-v3-the-watchers-descent",
      "title": "The Watchers' Descent",
      "subtitle": "The Unseen Age — Volume III",
      "author": "Triad of Angels",
      "year": "",
      "status": "Live",
      "sagaId": "the-god-story-saga",
      "seriesId": "unseen-age",
      "seriesNumber": 3,
      "genres": [],
      "formats": [
        "Kindle eBook"
      ],
      "logline": "The third volume descends into the darker pressure around the series, pushing the unseen conflict closer to the surface.",
      "description": "The Watchers' Descent carries the series further into spiritual conflict, escalation, and the sense that the hidden world is no longer staying hidden.",
      "canonicalPath": "/publishing/books/unseen-age-v3-the-watchers-descent/",
      "covers": {
        "portrait": "/assets/images/books/unseen-age-v3-the-watchers-descent/cover-portrait.webp",
        "square": "/assets/images/books/unseen-age-v3-the-watchers-descent/cover-portrait.webp",
        "wide": "/assets/images/books/unseen-age-v3-the-watchers-descent/cover-portrait.webp"
      },
      "stores": {
        "amazonRegional": {
          "AU": "https://www.amazon.com.au/dp/B0GR4HYXZW",
          "US": "https://www.amazon.com/dp/B0GR4HYXZW",
          "UK": "https://www.amazon.co.uk/dp/B0GR4HYXZW",
          "CA": "https://www.amazon.ca/dp/B0GR4HYXZW",
          "DE": "https://www.amazon.de/dp/B0GR4HYXZW",
          "FR": "https://www.amazon.fr/dp/B0GR4HYXZW",
          "ES": "https://www.amazon.es/dp/B0GR4HYXZW",
          "IT": "https://www.amazon.it/dp/B0GR4HYXZW",
          "JP": "https://www.amazon.co.jp/dp/B0GR4HYXZW",
          "IN": "https://www.amazon.in/dp/B0GR4HYXZW",
          "NL": "https://www.amazon.nl/dp/B0GR4HYXZW",
          "SE": "https://www.amazon.se/dp/B0GR4HYXZW"
        }
      }
    }
  ]
}
